{
  "schemaVersion": 1,
  "moduleId": "lm-foundations-learning",
  "version": 1,
  "locale": "de",
  "title": "Fehler in nächste Handlungen übersetzen",
  "description": "Meta-Lektion ohne Aufgaben: Fehlerjournal führen und daraus die nächste Handlung ableiten.",
  "competencyIds": [
    "c-meta-learning"
  ],
  "lessonIds": [
    "l-foundations-learning"
  ],
  "placements": [
    {
      "placementId": "p-foundations-learning-error-journal-next-test",
      "role": "curated",
      "familyId": "classify-error-hypothesis",
      "caseId": "error-journal-next-test",
      "seed": 0,
      "difficulty": "stretch",
      "estimatedMinutes": 8,
      "lessonId": "l-foundations-learning",
      "masteryEligible": true
    },
    {
      "placementId": "p-foundations-learning-error-journal-order",
      "role": "curated",
      "familyId": "construct-error-journal-order",
      "caseId": "journal-entry-order",
      "seed": 0,
      "difficulty": "core",
      "estimatedMinutes": 5,
      "lessonId": "l-foundations-learning",
      "masteryEligible": true
    },
    {
      "placementId": "p-foundations-learning-construct-error-journal-order-prac",
      "role": "practice-space",
      "familyId": "construct-error-journal-order",
      "difficulty": "core",
      "estimatedMinutes": 5,
      "lessonId": "l-foundations-learning"
    }
  ],
  "projectIds": [],
  "rightsId": "ki-lernplattform-original",
  "releaseStatus": "draft"
}
