{
  "schemaVersion": 1,
  "moduleId": "lm-linalg-independence",
  "version": 1,
  "locale": "de",
  "title": "Unabhängigkeit und Rang begründen",
  "description": "Determinante, Rang und abhängige Spalten als zusammenhängende Evidenz lesen.",
  "competencyIds": [
    "c-linalg-independence"
  ],
  "lessonIds": [
    "l-linalg-independence"
  ],
  "placements": [
    {
      "placementId": "p-linalg-independence-01-dependent-pair-double",
      "role": "curated",
      "familyId": "classify-independence-multiple",
      "caseId": "dependent-pair-double",
      "seed": 0,
      "difficulty": "intro",
      "estimatedMinutes": 5,
      "lessonId": "l-linalg-independence",
      "masteryEligible": false
    },
    {
      "placementId": "p-linalg-independence-02-rank-3x3-staircase",
      "role": "curated",
      "familyId": "transform-rank-dependence-rowops",
      "caseId": "rank-3x3-staircase",
      "seed": 0,
      "difficulty": "core",
      "estimatedMinutes": 8,
      "lessonId": "l-linalg-independence",
      "masteryEligible": true
    },
    {
      "placementId": "p-linalg-independence-03-det2-seeded-columns",
      "role": "curated",
      "familyId": "formula-det2-independence",
      "caseId": "det2-seeded-columns",
      "seed": 7,
      "difficulty": "core",
      "estimatedMinutes": 5,
      "lessonId": "l-linalg-independence",
      "masteryEligible": true
    },
    {
      "placementId": "p-linalg-independence-05-dependent-triple-span",
      "role": "curated",
      "familyId": "classify-independence-multiple",
      "caseId": "dependent-triple-span",
      "seed": 0,
      "difficulty": "stretch",
      "estimatedMinutes": 6,
      "lessonId": "l-linalg-independence",
      "masteryEligible": false
    },
    {
      "placementId": "p-linalg-independence-06-rank-3x3-full",
      "role": "curated",
      "familyId": "transform-rank-dependence-rowops",
      "caseId": "rank-3x3-full",
      "seed": 0,
      "difficulty": "stretch",
      "estimatedMinutes": 10,
      "lessonId": "l-linalg-independence",
      "masteryEligible": true
    },
    {
      "placementId": "p-linalg-independence-07-rank-3x4-line",
      "role": "curated",
      "familyId": "transform-rank-dependence-rowops",
      "caseId": "rank-3x4-line",
      "seed": 0,
      "difficulty": "challenge",
      "estimatedMinutes": 12,
      "lessonId": "l-linalg-independence",
      "masteryEligible": true
    },
    {
      "placementId": "p-linalg-independence-08-mcq-independence-statements",
      "role": "curated",
      "familyId": "multiple-choice-linalg-independence",
      "caseId": "independence-statements",
      "seed": 1,
      "difficulty": "core",
      "estimatedMinutes": 6,
      "lessonId": "l-linalg-independence",
      "masteryEligible": true
    },
    {
      "placementId": "p-linalg-independence-06-mcq-independent-sets-r2",
      "role": "curated",
      "familyId": "multiple-choice-linalg-independence",
      "caseId": "independent-sets-r2",
      "seed": 1,
      "difficulty": "intro",
      "estimatedMinutes": 6,
      "lessonId": "l-linalg-independence",
      "masteryEligible": true
    },
    {
      "placementId": "p-linalg-independence-09-mcq-independent-sets-r3",
      "role": "curated",
      "familyId": "multiple-choice-linalg-independence",
      "caseId": "independent-sets-r3",
      "seed": 1,
      "difficulty": "stretch",
      "estimatedMinutes": 8,
      "lessonId": "l-linalg-independence",
      "masteryEligible": true
    },
    {
      "placementId": "p-linalg-independence-10-mcq-rank-nullity-combined",
      "role": "curated",
      "familyId": "multiple-choice-linalg-independence",
      "caseId": "rank-nullity-combined",
      "seed": 1,
      "difficulty": "challenge",
      "estimatedMinutes": 10,
      "lessonId": "l-linalg-independence",
      "masteryEligible": true
    },
    {
      "placementId": "p-linalg-independence-04-formula-det2-independence-practice",
      "role": "practice-space",
      "familyId": "formula-det2-independence",
      "difficulty": "core",
      "estimatedMinutes": 0
    }
  ],
  "projectIds": [],
  "rightsId": "ki-lernplattform-original",
  "releaseStatus": "draft"
}
